{
  "title": "AI-Driven Intelligent Document Processing: A Hybrid Deep Learning Framework for Structured Content Extraction and IEEE-Compliant Reconstruction",
  "authors": [],
  "abstract": "The exponential growth of digital documents across academic, industrial, and governmental domains has necessitated the development of intelligent systems capable of extracting and restructuring complex information. Documents such as research papers, technical reports, and legal contracts often contain heterogeneous elements including multi-column text, tables, figures, and mathematical expressions, making automated processing a non-trivial task. Traditional rule-based and Optical Character Recognition (OCR)-centric approaches suffer from limited generalization and poor handling of structural complexity. This paper proposes a hybrid Artificial Intelligence (AI)-driven framework that integrates deep learning-based layout detection, advanced OCR techniques, Natural Language Processing (NLP), and symbolic recognition models to enable accurate extraction and reconstruction of structured document content. The system is specifically designed to convert unstructured or semi-structured documents into standardized IEEE-compliant formats. The proposed approach leverages convolutional neural networks (CNNs) for spatial layout understanding and transformer-based models for semantic interpretation. Extensive experiments demonstrate that the hybrid system significantly outperforms conventional pipelines in terms of structural accuracy, equation detection, and table reconstruction. The framework provides a scalable solution for automated document processing and has potential applications in academic publishing, enterprise automation, and digital archiving systems.",
  "keywords": [],
  "sections": [
    {
      "heading": "Introduction",
      "body": "The rapid digitization of information in the modern era has resulted in an overwhelming volume of documents that require automated processing, analysis, and restructuring. From academic research papers to financial reports and legal contracts, documents often contain complex layouts composed of text, tables, mathematical expressions, and graphical elements. Extracting meaningful and structured information from such documents remains a challenging problem due to variability in formatting, layout styles, and content representation.\n\nTraditional document processing systems primarily rely on rule-based heuristics and standard OCR techniques. While these methods perform adequately for simple, single-column text documents, they fail to handle complex layouts such as multi-column academic papers, embedded figures, nested tables, and mathematical equations. These limitations restrict their applicability in real-world scenarios, particularly in academic publishing workflows where precision and formatting compliance are critical.\n\nRecent advancements in Artificial Intelligence, particularly in deep learning and natural language processing, have opened new avenues for intelligent document understanding. Convolutional Neural Networks (CNNs) have demonstrated strong capabilities in image-based layout detection, while transformer-based models have revolutionized contextual understanding of textual data. However, most existing systems address individual components of document processing rather than providing a unified solution.\n\nThis paper presents a comprehensive hybrid framework that integrates multiple AI techniques to achieve end-to-end document processing. The proposed system not only extracts textual content but also identifies structural elements such as headings, tables, and equations, and reconstructs them into IEEE-compliant formats. The motivation behind this work stems from the need to automate academic formatting processes, reduce manual effort, and improve accuracy in document transformation tasks.",
      "tables": [],
      "figures": [],
      "depth": 1
    },
    {
      "heading": "Related Work",
      "body": "Document processing has been an active area of research for several decades, evolving from simple OCR-based systems to sophisticated AI-driven frameworks. Early approaches primarily focused on text extraction using OCR engines, which convert scanned images into machine-readable text. While these systems laid the foundation for document digitization, they were limited in their ability to understand document structure.\n\nSubsequent research introduced layout analysis techniques that aimed to segment documents into regions such as paragraphs, images, and tables. These methods often relied on handcrafted features and geometric rules, which made them sensitive to variations in document design. As a result, their performance degraded significantly when applied to diverse datasets.\n\nThe introduction of deep learning brought a paradigm shift in document analysis. CNN-based models enabled automatic feature extraction and improved accuracy in layout detection tasks. Systems such as region-based detectors and semantic segmentation models have been successfully applied to identify document components. In parallel, NLP techniques have been used to enhance semantic understanding, enabling tasks such as entity recognition and summarization.\n\nMore recent approaches leverage transformer architectures to jointly model visual and textual information. These models demonstrate improved performance in understanding complex relationships within documents. However, they often require large computational resources and extensive training data, which limits their practical deployment.\n\nDespite these advancements, existing solutions often lack integration across different processing stages. Many systems focus exclusively on either layout detection or text extraction, without addressing the complete pipeline required for structured reconstruction. This gap motivates the development of a hybrid framework that combines the strengths of multiple techniques to achieve robust and scalable document processing.",
      "tables": [],
      "figures": [],
      "depth": 1
    },
    {
      "heading": "System Overview",
      "body": "The proposed framework is designed as a modular pipeline consisting of multiple interconnected components, each responsible for a specific stage of document processing. The system begins with input preprocessing, followed by layout detection, content extraction, semantic analysis, and finally, document reconstruction.\n\nThe primary objective of the system is to transform unstructured documents into structured outputs that adhere to IEEE formatting standards. This involves not only extracting content but also preserving the hierarchical and spatial relationships between different elements.",
      "tables": [],
      "figures": [
        {
          "caption": "",
          "image_path": "C:\\Users\\janme\\Desktop\\minor\\formatter\\intermediate\\images\\fig_1_p3.png",
          "label": "fig:1"
        },
        {
          "caption": "",
          "image_path": "C:\\Users\\janme\\Desktop\\minor\\formatter\\intermediate\\images\\fig_2_p3.png",
          "label": "fig:2"
        }
      ],
      "depth": 2
    },
    {
      "heading": "Mathematical Representation",
      "body": "The document is modeled as a collection of elements:\n\n[ D = {e_1, e_2, e_3, ..., e_n} ]\n\nEach element is associated with spatial and semantic features:\n\n[ e_i = (x_i, y_i, w_i, h_i, f_i) ]\n\nWhere:\n\n$\\bullet$ (x_i, y_i) represent position\n\n$\\bullet$ (w_i, h_i) represent dimensions\n\n$\\bullet$ (f_i) represents feature vector\n\nClassification is performed using:\n\n[ C(e_i) = \\arg\\max_{k} P(class_k | f_i) ]",
      "tables": [],
      "figures": [],
      "depth": 2
    },
    {
      "heading": "Layout Detection",
      "body": "The layout detection module uses CNN-based object detection models to identify regions corresponding to text blocks, tables, images, and equations. The model is trained on annotated datasets containing labeled document layouts.\n\nThe detection process involves generating bounding boxes around each element and assigning class labels. This spatial information is crucial for preserving the structural integrity of the document during reconstruction.",
      "tables": [],
      "figures": [],
      "depth": 2
    },
    {
      "heading": "Text and Content Extraction",
      "body": "Text extraction is performed using advanced OCR techniques that combine image preprocessing with sequence recognition models. Preprocessing steps such as noise removal, binarization, and skew correction improve OCR accuracy.\n\nFor tables, a combination of structural analysis and cell segmentation techniques is used to reconstruct tabular data. Mathematical equations are detected using specialized models trained on symbol datasets, enabling recognition of complex expressions.",
      "tables": [],
      "figures": [],
      "depth": 2
    },
    {
      "heading": "Semantic Analysis",
      "body": "The extracted text is processed using NLP techniques to identify document structure, including headings, sections, and references. Transformer-based models are used to capture contextual relationships and improve classification accuracy.",
      "tables": [],
      "figures": [],
      "depth": 2
    },
    {
      "heading": "Document Reconstruction",
      "body": "The final stage involves converting the extracted and structured data into an IEEE-compliant format using LaTeX templates. This includes formatting text into columns, aligning tables, and rendering equations.",
      "tables": [],
      "figures": [],
      "depth": 2
    },
    {
      "heading": "Implementation",